{"nodes":[{"id":"48165","population":23956,"baseline_coverage":{"status":"reported","coverage_pct":81.9672131147541,"imputed":false,"imputation_method":null,"provenance":[{"source_id":"texas-dshs-kindergarten-2023","url":"https://www.dshs.texas.gov/sites/default/files/LIDS-Immunizations/xls/2023-2024_School_Vaccination_Coverage_Levels_Kindergarten.xlsx","retrieved_at":"2026-10-23T02:05:42Z","sha256":"79d242139bfb4ca0247e90a588541bf14435db52f0a87fb1182535878232bbba","licence_id":"texas-dshs-terms-unconfirmed"},{"source_id":"texas-dshs-county-fips","url":"https://www.dshs.texas.gov/center-health-statistics/texas-county-numbers-public-health-regions","retrieved_at":"2026-10-23T02:05:41Z","sha256":"fba299bafa2fa96c15cfe65c41d6586fdfedde48a2095a51cde6174ebbf0d3d0","licence_id":"texas-dshs-terms-unconfirmed"}]},"centroid":{"latitude":32.743942,"longitude":-102.631561},"initial_exposed":0,"initial_infectious":1,"provenance":[{"source_id":"census-county-population-2025","url":"https://www2.census.gov/programs-surveys/popest/datasets/2020-2025/counties/totals/co-est2025-alldata.csv","retrieved_at":"2026-10-07T03:55:35Z","sha256":"4f5a499d851e2cb48fd7a5405e5a9235453a8a66933657aacd10df0e264f35d5","licence_id":"us-census-public-domain"},{"source_id":"census-county-gazetteer-2025","url":"https://www2.census.gov/geo/docs/maps-data/data/gazetteer/2025_Gazetteer/2025_Gaz_counties_national.zip","retrieved_at":"2026-10-07T03:55:36Z","sha256":"4c90d0f805779923b5958ab13d0c1e9b99fe4932b786bfcf75dd739bb2dcb4ea","licence_id":"us-census-public-domain"}]}],"start_week":{"year":2025,"week":27},"coverage_overrides":[],"parameters":{"r0":{"kind":"uniform_prior","min":12.0,"max":18.0},"latent_period_days":10.0,"infectious_period_days":8.0,"mmr_effectiveness_one_dose":0.93,"mmr_effectiveness_two_doses":0.97,"time_step_days":1.0,"horizon_days":180,"gravity":null},"seed":20250304,"run_count":1000}
